{
  "$schema": "http://json-schema.org/draft-07/schema#",
  "$id": "https://www.mailinglisthackers.com/member.schema.json",
  "title": "Members",
  "description": "Mailing List Hackers members",
  "type": "object",
  "properties": {
    "name": {
      "description": "Member name",
      "type": "string"
    },
    "description": {
      "description": "Description",
      "type": "string"
    },
    "url": {
      "description": "Newsletter URL",
      "type": "string"
    },
    "newsletter": {
      "description": "Newsletter name",
      "type": "string"
    },
    "newsletter_url": {
      "description": "Newsletter URL",
      "type": "string"
    },
    "image": {
      "description": "Image URL",
      "type": "string"
    },
    "twitter": {
      "description": "Twitter URL",
      "type": "string"
    }
  },
  "required": [
    "name",
    "newsletter",
    "description",
    "image",
    "newsletter_url"
  ]
}
