{
  "name": "Bill Flitter",
  "twitter": "https://twitter.com/fixmygrowth",
  "url": "https://FixMyGrowth.com",
  "description": "20 years of experience helping startups grow.",
  "newsletter": "Fix My Growth",
  "newsletter_url": "https://FixMyGrowth.com",
  "image": "https://fixmygrowth.com/wp-content/uploads/2020/09/Bill-Flitter-Image-Round-2.png"
}
