{
  "name": "Frank Meeuwsen",
  "twitter": "https://twitter.com/frankmeeuwsen",
  "url": "https://thanksforsubscribing.app",
  "description": "Give your inbox more love with some of the best and interesting newsletter on this planet. With Thanks for Subscribing I collect, curate and share those nuggets with other newsletter creators, fans and afficionados.",
  "newsletter": "Thanks for Subscribing",
  "newsletter_url": "https://thanksforsubscribing.app",
  "image": "https://secure.gravatar.com/avatar/ae0d61ecec9ba68060523144917aed32"
}
