{
  "name": "Joseph Echavarria",
  "twitter": "https://twitter.com/josephech",
  "url": "www.josephech.com",
  "description": "Joseph.Ech. is an Architectural Designer,  Content Creator, and a huge Coffee Addict ☕️",
  "newsletter": "Life of a Designer",
  "newsletter_url": "https://josephech.substack.com/",
  "image": "https://i.postimg.cc/G3YBrBjh/Joseph.jpg"
}
