{
  "name": "Piotr Gaczkowski",
  "twitter": "https://twitter.com/doomhammerng",
  "url": "https://doomhammer.info",
  "description": "Creator. Efficiency Hacker. Human Jukebox. I want to inspire creative people to search for their own path.",
  "newsletter": "Bit Better Club",
  "newsletter_url": "https://bitbetter.club",
  "image": "https://doomhammer.info/img/photo.jpg"
}
