{
  "name": "Ryan Erickson",
  "twitter": "https://twitter.com/ryanerickson",
  "url": "https://pmfive.co",
  "description": "I write about Project Management covering leadership, business acument, training, and industry updates.",
  "newsletter": "The Stakeholder Report",
  "newsletter_url": "https://thestakeholderreport.substack.com",
  "image": "https://res.cloudinary.com/ryanerickson/image/upload/v1595707856/pmfive/FullSizeRender_Original_o.jpg"
}
